Tweet,Date,Retweets,Likes,Keyword,Positive,Negative,Neutral,Compound
"in the “old days,” when good news was reported, the stock market would go up. today, when good news is reported, th… https://t.co/mw5vewhzyy",2018-02-07,21163,109932,market,0.216,0.0,0.784,0.7003
"in the “old days,” when good news was reported, the stock market would go up. today, when good news is reported, th… https://t.co/mw5vewhzyy",2018-02-07,21163,109932,stock,0.216,0.0,0.784,0.7003
"in the “old days,” when good news was reported, the stock market would go up. today, when good news is reported, th… https://t.co/mw5vewhzyy",2018-02-07,21163,109932,market,0.216,0.0,0.784,0.7003
"thanks to the historic tax cuts that i signed into law, your paychecks are going way up, your taxes are going way d… https://t.co/dkvuox1qa6",2018-02-05,22015,103400,tax,0.111,0.084,0.805,0.1779
"great jobs numbers and finally, after many years, rising wages- and nobody even talks about them. only russia, russ… https://t.co/0gygnuj0bs",2018-02-04,28885,132341,jobs,0.177,0.0,0.823,0.6249
"great jobs numbers and finally, after many years, rising wages- and nobody even talks about them. only russia, russ… https://t.co/0gygnuj0bs",2018-02-04,28885,132341,jobs,0.177,0.0,0.823,0.6249
"great jobs numbers and finally, after many years, rising wages- and nobody even talks about them. only russia, russ… https://t.co/0gygnuj0bs",2018-02-04,28885,132341,wages,0.177,0.0,0.823,0.6249
"with 3.5 million americans receiving bonuses or other benefits from their employers as a result of tax cuts, 2018 i… https://t.co/cxo1rxddsj",2018-02-02,26458,105375,tax,0.244,0.087,0.669,0.6124
our economy is better than it has been in many decades. businesses are coming back to america like never before. ch… https://t.co/zrthptutnr,2018-01-28,40503,194669,economy,0.213,0.0,0.787,0.6597
"somebody please inform jay-z that because of my policies, black unemployment has just been reported to be at the lowest rate ever recorded!",2018-01-28,61103,233883,unemployment,0.082,0.206,0.712,-0.5411
democrats are not interested in border safety &amp; security or in the funding and rebuilding of our military. they are… https://t.co/wm9cl8cbo7,2018-01-28,34328,153074,build,0.204,0.089,0.707,0.4482
"taliban targeted innocent afghans, brave police in kabul today. our thoughts and prayers go to the victims, and fir… https://t.co/nxudzv0vyz",2018-01-27,21121,111262,ban,0.231,0.092,0.677,0.5423
"will soon be heading to davos, switzerland, to tell the world how great america is and is doing. our economy is now… https://t.co/owsysicike",2018-01-25,27192,148921,economy,0.157,0.0,0.843,0.6249
"rt @foxnews: .@kellyannepolls: ""since @potus took office, 863,000 new jobs were filled by women. over half a million american women have en…",2018-01-21,13986,0,jobs,0.0,0.0,1.0,0.0
"rt @foxnews: .@kellyannepolls: ""since @potus took office, 863,000 new jobs were filled by women. over half a million american women have en…",2018-01-21,13986,0,jobs,0.0,0.0,1.0,0.0
"unprecedented success for our country, in so many ways, since the election. record stock market, strong on military… https://t.co/s9vev9li6r",2018-01-20,27667,127331,market,0.292,0.0,0.708,0.7906
"unprecedented success for our country, in so many ways, since the election. record stock market, strong on military… https://t.co/s9vev9li6r",2018-01-20,27667,127331,stock,0.292,0.0,0.708,0.7906
"unprecedented success for our country, in so many ways, since the election. record stock market, strong on military… https://t.co/s9vev9li6r",2018-01-20,27667,127331,market,0.292,0.0,0.708,0.7906
"isis is in retreat, our economy is booming, investments and jobs are pouring back into the country, and so much mor… https://t.co/pxv43doqxa",2018-01-18,38317,174373,jobs,0.079,0.0,0.921,0.2023
"isis is in retreat, our economy is booming, investments and jobs are pouring back into the country, and so much mor… https://t.co/pxv43doqxa",2018-01-18,38317,174373,economy,0.079,0.0,0.921,0.2023
"isis is in retreat, our economy is booming, investments and jobs are pouring back into the country, and so much mor… https://t.co/pxv43doqxa",2018-01-18,38317,174373,jobs,0.079,0.0,0.921,0.2023
"during the campaign, i promised to make america great again by bringing businesses and jobs back to our country. i… https://t.co/oq1fa6odh7",2018-01-17,23727,96523,jobs,0.268,0.0,0.732,0.765
"during the campaign, i promised to make america great again by bringing businesses and jobs back to our country. i… https://t.co/oq1fa6odh7",2018-01-17,23727,96523,jobs,0.268,0.0,0.732,0.765
unemployment for black americans is the lowest ever recorded. trump approval ratings with black americans has doubl… https://t.co/t5tmchliz8,2018-01-16,26952,110188,unemployment,0.131,0.233,0.636,-0.34
"rt @realdonaldtrump: “president trump is not getting the credit he deserves for the economy. tax cut bonuses to more than 2,000,000 workers…",2018-01-16,24053,0,tax,0.134,0.159,0.707,0.0813
"rt @realdonaldtrump: “president trump is not getting the credit he deserves for the economy. tax cut bonuses to more than 2,000,000 workers…",2018-01-16,24053,0,economy,0.134,0.159,0.707,0.0813
"“president trump is not getting the credit he deserves for the economy. tax cut bonuses to more than 2,000,000 work… https://t.co/0us33d7euy",2018-01-14,24053,109000,tax,0.139,0.166,0.695,0.0813
"“president trump is not getting the credit he deserves for the economy. tax cut bonuses to more than 2,000,000 work… https://t.co/0us33d7euy",2018-01-14,24053,109000,economy,0.139,0.166,0.695,0.0813
the wall street journal stated falsely that i said to them “i have a good relationship with kim jong un” (of n. kor… https://t.co/zvyn9rhbfn,2018-01-14,21468,93317,kim,0.121,0.0,0.879,0.4404
rt @loudobbs: the stock market has gained an incredible 7.8 trillion dollars in market value since @potus was elected! looks like 4% econom…,2018-01-14,17449,0,market,0.28,0.0,0.72,0.7777
rt @loudobbs: the stock market has gained an incredible 7.8 trillion dollars in market value since @potus was elected! looks like 4% econom…,2018-01-14,17449,0,stock,0.28,0.0,0.72,0.7777
rt @loudobbs: the stock market has gained an incredible 7.8 trillion dollars in market value since @potus was elected! looks like 4% econom…,2018-01-14,17449,0,market,0.28,0.0,0.72,0.7777
"yesterday was a big day for the stock market. jobs are coming back to america. chrysler is coming back to the usa,… https://t.co/0bkc8rejra",2018-01-13,23375,114320,market,0.0,0.0,1.0,0.0
"yesterday was a big day for the stock market. jobs are coming back to america. chrysler is coming back to the usa,… https://t.co/0bkc8rejra",2018-01-13,23375,114320,stock,0.0,0.0,1.0,0.0
"yesterday was a big day for the stock market. jobs are coming back to america. chrysler is coming back to the usa,… https://t.co/0bkc8rejra",2018-01-13,23375,114320,market,0.0,0.0,1.0,0.0
"yesterday was a big day for the stock market. jobs are coming back to america. chrysler is coming back to the usa,… https://t.co/0bkc8rejra",2018-01-13,23375,114320,jobs,0.0,0.0,1.0,0.0
"yesterday was a big day for the stock market. jobs are coming back to america. chrysler is coming back to the usa,… https://t.co/0bkc8rejra",2018-01-13,23375,114320,jobs,0.0,0.0,1.0,0.0
more great news as a result of historical tax cuts and reform: fiat chrysler announces plan to invest more than $1… https://t.co/k7893jxdwc,2018-01-12,18347,71315,tax,0.172,0.086,0.742,0.4927
"great news, as a result of our tax cuts &amp; jobs act! https://t.co/slvhlxp3jl",2018-01-11,14428,60768,tax,0.265,0.133,0.603,0.4926
"great news, as a result of our tax cuts &amp; jobs act! https://t.co/slvhlxp3jl",2018-01-11,14428,60768,jobs,0.265,0.133,0.603,0.4926
"great news, as a result of our tax cuts &amp; jobs act! https://t.co/slvhlxp3jl",2018-01-11,14428,60768,jobs,0.265,0.133,0.603,0.4926
"in new quinnipiac poll, 66% of people feel the economy is “excellent or good.” that is the highest number ever recorded by this poll.",2018-01-11,20229,93972,economy,0.053,0.0,0.947,0.0772
cutting taxes and simplifying regulations makes america the place to invest! great news as toyota and mazda announc… https://t.co/aev6vyzomh,2018-01-10,21903,87247,tax,0.192,0.066,0.743,0.5983
"rt @scavino45: “utilities cutting rates, cite benefits of trump tax reform” https://t.co/u19jms4bsr",2018-01-09,11102,0,tax,0.184,0.106,0.709,0.2732
"in every decision we make, we are honoring america’s proud farming legacy. years of crushing taxes, crippling regs,… https://t.co/biaoh3znuz",2018-01-08,17061,78952,tax,0.257,0.1,0.643,0.5994
african american unemployment is the lowest ever recorded in our country. the hispanic unemployment rate dropped a… https://t.co/1sj1vhcqfi,2018-01-08,33157,128428,unemployment,0.0,0.359,0.641,-0.8126
the stock market has been creating tremendous benefits for our country in the form of not only record setting stock… https://t.co/ztq2hdj7rr,2018-01-07,19411,97553,market,0.202,0.0,0.798,0.5859
the stock market has been creating tremendous benefits for our country in the form of not only record setting stock… https://t.co/ztq2hdj7rr,2018-01-07,19411,97553,stock,0.202,0.0,0.798,0.5859
the stock market has been creating tremendous benefits for our country in the form of not only record setting stock… https://t.co/ztq2hdj7rr,2018-01-07,19411,97553,market,0.202,0.0,0.798,0.5859
"brian ross, the reporter who made a fraudulent live newscast about me that drove the stock market down 350 points (… https://t.co/cbz6ndw2l8",2018-01-06,22326,115935,market,0.0,0.138,0.862,-0.4939
"brian ross, the reporter who made a fraudulent live newscast about me that drove the stock market down 350 points (… https://t.co/cbz6ndw2l8",2018-01-06,22326,115935,stock,0.0,0.138,0.862,-0.4939
"brian ross, the reporter who made a fraudulent live newscast about me that drove the stock market down 350 points (… https://t.co/cbz6ndw2l8",2018-01-06,22326,115935,market,0.0,0.138,0.862,-0.4939
"the african american unemployment rate fell to 6.8%, the lowest rate in 45 years. i am so happy about this news! an… https://t.co/ceem2l6yhv",2018-01-06,31235,140872,unemployment,0.161,0.196,0.643,0.1364
the mercer family recently dumped the leaker known as sloppy steve bannon. smart!,2018-01-05,15054,77226,ban,0.165,0.165,0.671,0.0
the fake news media barely mentions the fact that the stock market just hit another new record and that business in… https://t.co/skkiyt1qj2,2018-01-05,26845,125586,market,0.0,0.129,0.871,-0.4767
the fake news media barely mentions the fact that the stock market just hit another new record and that business in… https://t.co/skkiyt1qj2,2018-01-05,26845,125586,stock,0.0,0.129,0.871,-0.4767
the fake news media barely mentions the fact that the stock market just hit another new record and that business in… https://t.co/skkiyt1qj2,2018-01-05,26845,125586,market,0.0,0.129,0.871,-0.4767
"thank you to the great republican senators who showed up to our mtg on immigration reform. we must build the wall,… https://t.co/zkhx30vumi",2018-01-04,28869,133626,build,0.248,0.0,0.752,0.765
"stock market had another good day but, now that the tax cut bill has passed, we have tremendous upward potential. d… https://t.co/ntaj1fdp2u",2018-01-04,19026,103735,market,0.079,0.108,0.813,-0.1779
"stock market had another good day but, now that the tax cut bill has passed, we have tremendous upward potential. d… https://t.co/ntaj1fdp2u",2018-01-04,19026,103735,stock,0.079,0.108,0.813,-0.1779
"stock market had another good day but, now that the tax cut bill has passed, we have tremendous upward potential. d… https://t.co/ntaj1fdp2u",2018-01-04,19026,103735,market,0.079,0.108,0.813,-0.1779
"stock market had another good day but, now that the tax cut bill has passed, we have tremendous upward potential. d… https://t.co/ntaj1fdp2u",2018-01-04,19026,103735,tax,0.079,0.108,0.813,-0.1779
“some 40 u.s. companies have responded to president trump’s tax cut and reform victory in congress last year by han… https://t.co/98ztvwf2pe,2018-01-04,16040,66478,tax,0.0,0.095,0.905,-0.2732
north korean leader kim jong un just stated that the “nuclear button is on his desk at all times.” will someone fro… https://t.co/evtgzxiji0,2018-01-03,184462,488636,kim,0.0,0.0,1.0,0.0
north korean leader kim jong un just stated that the “nuclear button is on his desk at all times.” will someone fro… https://t.co/evtgzxiji0,2018-01-03,184462,488636,nuclear,0.0,0.0,1.0,0.0
sanctions and “other” pressures are beginning to have a big impact on north korea. soldiers are dangerously fleeing… https://t.co/lfl6gb81v7,2018-01-02,16596,75752,sanctions,0.0,0.249,0.751,-0.6486
companies are giving big bonuses to their workers because of the tax cut bill. really great!,2018-01-02,14933,84604,tax,0.431,0.085,0.484,0.862
"if the dems (crooked hillary) got elected, your stocks would be down 50% from values on election day. now they have… https://t.co/ejoxpgschk",2017-12-31,15026,69928,stock,0.114,0.0,0.886,0.4019
“trump rally: stocks put 2017 in the record books” https://t.co/0foqgafjmh,2017-12-31,13337,63718,stock,0.0,0.0,1.0,0.0
jobs are kicking in and companies are coming back to the u.s. unnecessary regulations and high taxes are being dram… https://t.co/ts9xxdjqzu,2017-12-30,24482,122709,tax,0.0,0.0,1.0,0.0
jobs are kicking in and companies are coming back to the u.s. unnecessary regulations and high taxes are being dram… https://t.co/ts9xxdjqzu,2017-12-30,24482,122709,jobs,0.0,0.0,1.0,0.0
jobs are kicking in and companies are coming back to the u.s. unnecessary regulations and high taxes are being dram… https://t.co/ts9xxdjqzu,2017-12-30,24482,122709,jobs,0.0,0.0,1.0,0.0
"on taxes: “this is the biggest corporate rate cut ever, going back to the corporate income tax rate of roughly 80 y… https://t.co/xthivribyk",2017-12-30,16580,76846,corporate,0.0,0.087,0.913,-0.2732
"on taxes: “this is the biggest corporate rate cut ever, going back to the corporate income tax rate of roughly 80 y… https://t.co/xthivribyk",2017-12-30,16580,76846,tax,0.0,0.087,0.913,-0.2732
"rt @charliekirk11: incredible video: @cbs does a special on the gop tax plan 

the result?

every middle class family they sat down with sa…",2017-12-29,15186,0,tax,0.109,0.0,0.891,0.4019
rt @ivankatrump: “the trump economy is booming.” one thing @realdonaldtrump “has done that has received little attention despite arguably d…,2017-12-28,11628,0,economy,0.072,0.0,0.928,0.1221
caught red handed - very disappointed that china is allowing oil to go into north korea. there will never be a frie… https://t.co/aia4cfxnoa,2017-12-28,30450,123280,china,0.0,0.145,0.855,-0.5256
retail sales are at record numbers. we’ve got the economy going better than anyone ever dreamt - and you haven’t seen anything yet!,2017-12-28,20629,107317,economy,0.132,0.0,0.868,0.4926
"all signs are that business is looking really good for next year, only to be helped further by our tax cut bill. wi… https://t.co/f37vetylej",2017-12-26,24188,128147,tax,0.117,0.077,0.806,0.2716
based on the fact that the very unfair and unpopular individual mandate has been terminated as part of our tax cut… https://t.co/sz3yczc3mr,2017-12-26,19591,107594,tax,0.0,0.139,0.861,-0.5256
rt @erictrump: we should all take a moment to say a prayer for those who paid the ultimate price  — their bravery and sacrifice allows us t…,2017-12-25,22589,0,price,0.122,0.0,0.878,0.4939
"the tax cut/reform bill, including massive alaska drilling and the repeal of the highly unpopular individual mandat… https://t.co/kgkngzk6md",2017-12-24,21993,108528,tax,0.0,0.0,1.0,0.0
the stock market is setting record after record and unemployment is at a 17 year low. so many things accomplished b… https://t.co/bctmatxwb2,2017-12-23,21561,98618,market,0.121,0.191,0.688,-0.2111
the stock market is setting record after record and unemployment is at a 17 year low. so many things accomplished b… https://t.co/bctmatxwb2,2017-12-23,21561,98618,stock,0.121,0.191,0.688,-0.2111
the stock market is setting record after record and unemployment is at a 17 year low. so many things accomplished b… https://t.co/bctmatxwb2,2017-12-23,21561,98618,market,0.121,0.191,0.688,-0.2111
the stock market is setting record after record and unemployment is at a 17 year low. so many things accomplished b… https://t.co/bctmatxwb2,2017-12-23,21561,98618,unemployment,0.121,0.191,0.688,-0.2111
"remember, the most hated part of obamacare is the individual mandate, which is being terminated under our just signed tax cut bill.",2017-12-22,24267,117732,tax,0.0,0.248,0.752,-0.7645
"today, it was my great honor to sign the largest tax cuts and reform in the history of our country. full remarks:… https://t.co/1plwmp1sx9",2017-12-22,15173,67199,tax,0.247,0.075,0.678,0.7269
"the united nations security council just voted 15-0 in favor of additional sanctions on north korea. the world wants peace, not death!",2017-12-22,18195,88440,sanctions,0.466,0.0,0.534,0.9305
"95% of americans will pay less or, at worst, the same amount of taxes (mostly far less). the dems only want to raise your taxes!",2017-12-22,20477,101155,tax,0.045,0.192,0.763,-0.6403
will be signing the biggest ever tax cut and reform bill in 30 minutes in oval office. will also be signing a much… https://t.co/fggbqdb0wg,2017-12-22,18335,100303,tax,0.0,0.087,0.913,-0.2732
our big and very popular tax cut and reform bill has taken on an unexpected new source of “love” - that is big comp… https://t.co/jncqyxyqbh,2017-12-22,21150,92581,tax,0.113,0.086,0.801,0.1851
"house democrats want a shutdown for the holidays in order to distract from the very popular, just passed, tax cuts.… https://t.co/nrqrr8w3pp",2017-12-21,19792,86332,tax,0.278,0.087,0.635,0.5849
"the massive tax cuts, which the fake news media is desperate to write badly about so as to please their democrat bo… https://t.co/9rzmbbjpqo",2017-12-21,24349,108422,tax,0.082,0.342,0.576,-0.7984
"we are delivering historic tax relief for the american people!
#taxcutsandjobsact https://t.co/llgatrch5o",2017-12-20,19763,80816,tax,0.236,0.0,0.764,0.5255
"we are delivering historic tax relief for the american people!
#taxcutsandjobsact https://t.co/llgatrch5o",2017-12-20,19763,80816,jobs,0.236,0.0,0.764,0.5255
"we are delivering historic tax relief for the american people!
#taxcutsandjobsact https://t.co/llgatrch5o",2017-12-20,19763,80816,jobs,0.236,0.0,0.764,0.5255
"the tax cuts are so large and so meaningful, and yet the fake news is working overtime to follow the lead of their… https://t.co/tkdgqwixwf",2017-12-20,17213,76912,tax,0.102,0.181,0.717,-0.3201
the united states senate just passed the biggest in history tax cut and reform bill. terrible individual mandate (o… https://t.co/uk5nuk2ymo,2017-12-20,30134,136268,tax,0.112,0.208,0.68,-0.34
stocks and the economy have a long way to go after the tax cut bill is totally understood and appreciated in scope… https://t.co/2bjwfd1ctu,2017-12-19,13748,67874,stock,0.139,0.082,0.779,0.3535
stocks and the economy have a long way to go after the tax cut bill is totally understood and appreciated in scope… https://t.co/2bjwfd1ctu,2017-12-19,13748,67874,tax,0.139,0.082,0.779,0.3535
stocks and the economy have a long way to go after the tax cut bill is totally understood and appreciated in scope… https://t.co/2bjwfd1ctu,2017-12-19,13748,67874,economy,0.139,0.082,0.779,0.3535
"together, our task is to strengthen our families, to build up our communities, to serve our citizens, and to celebr… https://t.co/qsoyvl1mxs",2017-12-19,15967,64943,build,0.103,0.0,0.897,0.3182
"as the world watches, we are days away from passing historic tax cuts for american families and businesses. it will… https://t.co/95522wikvn",2017-12-18,9615,47251,tax,0.0,0.099,0.901,-0.296
"as a candidate, i promised we would pass a massive tax cut for the everyday working american families who are the b… https://t.co/staotr50ef",2017-12-17,17520,82978,tax,0.111,0.093,0.796,0.1027
"tax cuts will increase investment in the american economy and in u.s. workers, leading to higher growth, higher wag… https://t.co/bl5onhuhib",2017-12-16,14619,68097,tax,0.203,0.091,0.705,0.4019
"tax cuts will increase investment in the american economy and in u.s. workers, leading to higher growth, higher wag… https://t.co/bl5onhuhib",2017-12-16,14619,68097,economy,0.203,0.091,0.705,0.4019
"rt @repkristinoem: a lot of tough decisions got us to this point, but we’re closer than we’ve been in 30+ years to a fairer tax code that k…",2017-12-16,6434,0,tax,0.0,0.048,0.952,-0.0644
"rt @speakerryan: for individuals and families, the final tax cuts &amp; jobs act:
✔lowers individual taxes
✔nearly doubles the standard deducti…",2017-12-16,9790,0,tax,0.0,0.099,0.901,-0.296
"rt @speakerryan: for individuals and families, the final tax cuts &amp; jobs act:
✔lowers individual taxes
✔nearly doubles the standard deducti…",2017-12-16,9790,0,jobs,0.0,0.099,0.901,-0.296
"rt @speakerryan: for individuals and families, the final tax cuts &amp; jobs act:
✔lowers individual taxes
✔nearly doubles the standard deducti…",2017-12-16,9790,0,jobs,0.0,0.099,0.901,-0.296
rt @presssec: .@potus historic tax cuts + doubling of the child tax credit will do infinitely more to empower working moms than liberals' p…,2017-12-16,15270,0,tax,0.101,0.085,0.814,0.1027
"dow, s&amp;p 500 and nasdaq close at record highs! #maga https://t.co/hvqwnqsgug",2017-12-16,12346,55775,nasdaq,0.0,0.0,1.0,0.0
rt @gopchairwoman: .@realdonaldtrump is the paycheck president. learn how the tax bill will put more money in your pocket &amp; how to contact…,2017-12-14,10408,0,tax,0.0,0.0,1.0,0.0
"as a candidate, i promised we would pass a massive tax cut for the everyday, working americans. if you make your vo… https://t.co/nmvg40pwj8",2017-12-14,17446,74691,tax,0.111,0.093,0.796,0.1027
"republican tax cuts are looking very good. all are working hard. in the meantime, the stock market hit another record high!",2017-12-14,16348,89898,market,0.127,0.155,0.718,0.2228
"republican tax cuts are looking very good. all are working hard. in the meantime, the stock market hit another record high!",2017-12-14,16348,89898,stock,0.127,0.155,0.718,0.2228
"republican tax cuts are looking very good. all are working hard. in the meantime, the stock market hit another record high!",2017-12-14,16348,89898,market,0.127,0.155,0.718,0.2228
"republican tax cuts are looking very good. all are working hard. in the meantime, the stock market hit another record high!",2017-12-14,16348,89898,tax,0.127,0.155,0.718,0.2228
"consumer confidence is at an all-time high, along with a record high stock market. unemployment is at a 17 year low… https://t.co/zedqbntlyg",2017-12-12,18994,89041,market,0.136,0.12,0.744,0.1027
"consumer confidence is at an all-time high, along with a record high stock market. unemployment is at a 17 year low… https://t.co/zedqbntlyg",2017-12-12,18994,89041,stock,0.136,0.12,0.744,0.1027
"consumer confidence is at an all-time high, along with a record high stock market. unemployment is at a 17 year low… https://t.co/zedqbntlyg",2017-12-12,18994,89041,market,0.136,0.12,0.744,0.1027
"consumer confidence is at an all-time high, along with a record high stock market. unemployment is at a 17 year low… https://t.co/zedqbntlyg",2017-12-12,18994,89041,unemployment,0.136,0.12,0.744,0.1027
getting closer and closer on the tax cut bill. shaping up even better than projected. house and senate working very… https://t.co/fklvfqsmsk,2017-12-10,17260,92590,tax,0.121,0.088,0.792,0.2023
"things are going really well for our economy, a subject the fake news spends as little time as possible discussing!… https://t.co/hzfaovkx9l",2017-12-10,27274,123092,economy,0.101,0.143,0.757,-0.2498
"“the unemployment rate remains at a 17-year low of 4.1%. the unemployment rate in manufacturing dropped to 2.6%, th… https://t.co/ujuflrg8lc",2017-12-08,17066,63425,unemployment,0.0,0.331,0.669,-0.7845
fines and penalties against wells fargo bank for their bad acts against their customers and others will not be drop… https://t.co/eg8rslwjfa,2017-12-08,21621,95438,ban,0.082,0.143,0.776,-0.3612
"with the great vote on cutting taxes, this could be a big day for the stock market - and you!",2017-12-04,15805,87894,market,0.201,0.069,0.731,0.5983
"with the great vote on cutting taxes, this could be a big day for the stock market - and you!",2017-12-04,15805,87894,stock,0.201,0.069,0.731,0.5983
"with the great vote on cutting taxes, this could be a big day for the stock market - and you!",2017-12-04,15805,87894,market,0.201,0.069,0.731,0.5983
"with the great vote on cutting taxes, this could be a big day for the stock market - and you!",2017-12-04,15805,87894,tax,0.201,0.069,0.731,0.5983
democrats refusal to give even one vote for massive tax cuts is why we need republican roy moore to win in alabama.… https://t.co/cttqha3yxl,2017-12-04,24761,93447,tax,0.141,0.081,0.778,0.3818
people who lost money when the stock market went down 350 points based on the false and dishonest reporting of bria… https://t.co/4mt8wja1pn,2017-12-03,35088,119302,market,0.0,0.231,0.769,-0.7184
people who lost money when the stock market went down 350 points based on the false and dishonest reporting of bria… https://t.co/4mt8wja1pn,2017-12-03,35088,119302,stock,0.0,0.231,0.769,-0.7184
people who lost money when the stock market went down 350 points based on the false and dishonest reporting of bria… https://t.co/4mt8wja1pn,2017-12-03,35088,119302,market,0.0,0.231,0.769,-0.7184
"rt @presssec: the trump effect: “the u.s. economy is running at its full potential for the first time in a decade” -wsj
https://t.co/ee5n0z…",2017-12-03,14186,0,economy,0.0,0.0,1.0,0.0
