Tweet,Date,Retweets,Likes,Keyword,Positive,Negative,Neutral,Compound
stock market hits new record high. confidence and enthusiasm abound. more great numbers coming out!,2017-11-30,15120,85504,market,0.476,0.0,0.524,0.8976
stock market hits new record high. confidence and enthusiasm abound. more great numbers coming out!,2017-11-30,15120,85504,stock,0.476,0.0,0.524,0.8976
stock market hits new record high. confidence and enthusiasm abound. more great numbers coming out!,2017-11-30,15120,85504,market,0.476,0.0,0.524,0.8976
the only people who don’t like the tax cut bill are the people that don’t understand it or the obstructionist democ… https://t.co/kr5hj8olcq,2017-11-30,17522,77599,tax,0.102,0.085,0.813,0.1027
"a vote to cut taxes is a vote to put america first. it is time to take care of our workers, to protect our communit… https://t.co/werio83ae6",2017-11-29,10867,47097,tax,0.201,0.073,0.727,0.5719
"departing @jba_nafw for st. charles, missouri to help push our plan for historic tax cuts across the finish line.… https://t.co/a9i7mvnhud",2017-11-29,7907,39436,tax,0.118,0.096,0.786,0.128
"economy growing! excluding hurricane effects, cea estimates that real gdp growth would have been 3.9% in q3.

stock… https://t.co/ceei9ux8mo",2017-11-29,11129,47818,stock,0.213,0.0,0.787,0.5562
"economy growing! excluding hurricane effects, cea estimates that real gdp growth would have been 3.9% in q3.

stock… https://t.co/ceei9ux8mo",2017-11-29,11129,47818,economy,0.213,0.0,0.787,0.5562
just spoke to president xi jinping of china concerning the provocative actions of north korea. additional major san… https://t.co/h6gq5vdcso,2017-11-29,19634,98009,china,0.0,0.0,1.0,0.0
looks like another great day for the stock market. consumer confidence is at record high. i guess somebody likes me (my policies)!,2017-11-29,14356,82725,market,0.433,0.0,0.567,0.9184
looks like another great day for the stock market. consumer confidence is at record high. i guess somebody likes me (my policies)!,2017-11-29,14356,82725,stock,0.433,0.0,0.567,0.9184
looks like another great day for the stock market. consumer confidence is at record high. i guess somebody likes me (my policies)!,2017-11-29,14356,82725,market,0.433,0.0,0.567,0.9184
".@foxandfriends, we are in record territory in all things having to do with our economy! https://t.co/vb0ao3s18d",2017-11-29,7714,36413,economy,0.0,0.0,1.0,0.0
great day for tax cuts and the republican party. but the biggest winner will be our great country!,2017-11-29,12574,70225,tax,0.516,0.053,0.431,0.9427
"after north korea missile launch, it's more important than ever to fund our gov't &amp; military! dems shouldn't hold t… https://t.co/lhxvhhiles",2017-11-29,22448,92518,missile,0.107,0.0,0.893,0.3367
"dow, s&amp;p 500 and nasdaq all finished the day at new record highs! https://t.co/wjyb9d00hh",2017-11-28,9970,46212,nasdaq,0.0,0.0,1.0,0.0
new home sales reach a 10 year high. stock market has more record gains. hopefully republican senators will give us… https://t.co/drej6cawjm,2017-11-28,15493,75196,market,0.284,0.0,0.716,0.6948
new home sales reach a 10 year high. stock market has more record gains. hopefully republican senators will give us… https://t.co/drej6cawjm,2017-11-28,15493,75196,stock,0.284,0.0,0.716,0.6948
new home sales reach a 10 year high. stock market has more record gains. hopefully republican senators will give us… https://t.co/drej6cawjm,2017-11-28,15493,75196,market,0.284,0.0,0.716,0.6948
"the tax cut bill is coming along very well, great support. with just a few changes, some mathematical, the middle c… https://t.co/p1ggkhvyxy",2017-11-27,15253,81223,tax,0.338,0.073,0.59,0.8241
"back in d.c., big week for tax cuts and many other things of great importance to our country.  senate republicans w… https://t.co/t9l8z9ctyw",2017-11-27,16127,84196,tax,0.237,0.079,0.683,0.6597
"happy thanksgiving, your country is starting to do really well. jobs coming back, highest stock market ever, milita… https://t.co/jmdse29w8e",2017-11-23,41750,200519,market,0.264,0.0,0.736,0.7264
"happy thanksgiving, your country is starting to do really well. jobs coming back, highest stock market ever, milita… https://t.co/jmdse29w8e",2017-11-23,41750,200519,stock,0.264,0.0,0.736,0.7264
"happy thanksgiving, your country is starting to do really well. jobs coming back, highest stock market ever, milita… https://t.co/jmdse29w8e",2017-11-23,41750,200519,market,0.264,0.0,0.736,0.7264
"happy thanksgiving, your country is starting to do really well. jobs coming back, highest stock market ever, milita… https://t.co/jmdse29w8e",2017-11-23,41750,200519,jobs,0.264,0.0,0.736,0.7264
"happy thanksgiving, your country is starting to do really well. jobs coming back, highest stock market ever, milita… https://t.co/jmdse29w8e",2017-11-23,41750,200519,jobs,0.264,0.0,0.736,0.7264
....and it will get even better with tax cuts! https://t.co/75wozgjqop,2017-11-23,9738,49744,tax,0.238,0.164,0.597,0.2481
will be having meetings and working the phones from the winter white house in florida (mar-a-lago). stock market hi… https://t.co/nfmwwxtyry,2017-11-22,14863,75475,market,0.0,0.0,1.0,0.0
will be having meetings and working the phones from the winter white house in florida (mar-a-lago). stock market hi… https://t.co/nfmwwxtyry,2017-11-22,14863,75475,stock,0.0,0.0,1.0,0.0
will be having meetings and working the phones from the winter white house in florida (mar-a-lago). stock market hi… https://t.co/nfmwwxtyry,2017-11-22,14863,75475,market,0.0,0.0,1.0,0.0
"rt @ingrahamangle: “far right”? you mean “right so far,” as in @realdonaldtrump has been right so far abt how to kick the economy into high…",2017-11-22,9289,0,economy,0.0,0.0,1.0,0.0
"...lavar, you could have spent the next 5 to 10 years during thanksgiving with your son in china, but no nba contra… https://t.co/r7yb95fkuw",2017-11-22,36531,155059,china,0.0,0.118,0.882,-0.4215
under president trump unemployment rate will drop below 4%.  analysts predict economic boom for 2018!  @foxandfriends and @varneyco,2017-11-20,16985,76524,unemployment,0.0,0.249,0.751,-0.6476
republican senators are working very hard to get tax cuts and tax reform approved. hopefully it will not be long an… https://t.co/m0gyfbdpkq,2017-11-20,13984,71761,tax,0.201,0.142,0.657,0.3832
"shoplifting is a very big deal in china, as it should be (5-10 years in jail), but not to father lavar. should have… https://t.co/tydmchjeim",2017-11-19,28261,130453,china,0.0,0.0,1.0,0.0
"now that the three basketball players are out of china and saved from years in jail, lavar ball, the father of lian… https://t.co/371qj1biwh",2017-11-19,71969,265403,china,0.113,0.0,0.887,0.4215
"if democrats were not such obstructionists and understood the power of lower taxes, we would be able to get many of their ideas into bill!",2017-11-17,20314,96238,tax,0.0,0.094,0.906,-0.3595
"great numbers on stocks and the economy. if we get tax cuts and reform, we'll really see some great results!",2017-11-17,13779,72331,stock,0.307,0.079,0.614,0.807
"great numbers on stocks and the economy. if we get tax cuts and reform, we'll really see some great results!",2017-11-17,13779,72331,tax,0.307,0.079,0.614,0.807
"great numbers on stocks and the economy. if we get tax cuts and reform, we'll really see some great results!",2017-11-17,13779,72331,economy,0.307,0.079,0.614,0.807
"big win today in the house for gop tax cuts and reform, 227-205. zero dems, they want to raise taxes much higher, but not for our military!",2017-11-17,12111,61566,tax,0.13,0.054,0.815,0.3054
congratulations to the house of representatives for passing the #taxcutsandjobsact — a big step toward fulfilling o… https://t.co/gkn9az40yf,2017-11-16,15269,65521,tax,0.206,0.0,0.794,0.5994
congratulations to the house of representatives for passing the #taxcutsandjobsact — a big step toward fulfilling o… https://t.co/gkn9az40yf,2017-11-16,15269,65521,jobs,0.206,0.0,0.794,0.5994
congratulations to the house of representatives for passing the #taxcutsandjobsact — a big step toward fulfilling o… https://t.co/gkn9az40yf,2017-11-16,15269,65521,jobs,0.206,0.0,0.794,0.5994
"china is sending an envoy and delegation to north korea - a big move, we'll see what happens!",2017-11-16,18470,87827,china,0.0,0.0,1.0,0.0
"to the three ucla basketball players i say:  you're welcome, go out and give a big thank you to president xi jinping of china who made.....",2017-11-16,17052,85749,china,0.2,0.0,0.8,0.6705
big vote tomorrow in the house. tax cuts are getting close!,2017-11-16,11371,68193,tax,0.0,0.199,0.801,-0.3595
why are democrats fighting massive tax cuts for the middle class and business (jobs)? the reason: obstruction and delay!,2017-11-16,22455,97665,tax,0.0,0.313,0.687,-0.7424
why are democrats fighting massive tax cuts for the middle class and business (jobs)? the reason: obstruction and delay!,2017-11-16,22455,97665,jobs,0.0,0.313,0.687,-0.7424
why are democrats fighting massive tax cuts for the middle class and business (jobs)? the reason: obstruction and delay!,2017-11-16,22455,97665,jobs,0.0,0.313,0.687,-0.7424
"...they should realize that these relationships are a good thing, not a bad thing. the u.s. is being respected again. watch trade!",2017-11-15,14666,81796,trade,0.35,0.0,0.65,0.8459
"the failing @nytimes hates the fact that i have developed a great relationship with world leaders like xi jinping, president of china.....",2017-11-15,13350,64405,china,0.229,0.215,0.556,0.1027
"rt @realdonaldtrump: unemployment is down to 4.1%, lowest in 17 years. 1.5 million new jobs created since i took office. highest stock mark…",2017-11-15,36727,0,stock,0.075,0.208,0.717,-0.5423
"rt @realdonaldtrump: unemployment is down to 4.1%, lowest in 17 years. 1.5 million new jobs created since i took office. highest stock mark…",2017-11-15,36727,0,unemployment,0.075,0.208,0.717,-0.5423
"rt @realdonaldtrump: unemployment is down to 4.1%, lowest in 17 years. 1.5 million new jobs created since i took office. highest stock mark…",2017-11-15,36727,0,jobs,0.075,0.208,0.717,-0.5423
"rt @realdonaldtrump: unemployment is down to 4.1%, lowest in 17 years. 1.5 million new jobs created since i took office. highest stock mark…",2017-11-15,36727,0,jobs,0.075,0.208,0.717,-0.5423
"just arrived at #asean50 in the philippines for my final stop with world leaders. will lead to fair trade deals, un… https://t.co/exrbdqnjru",2017-11-14,8044,46453,trade,0.094,0.09,0.816,0.0258
"after my tour of asia, all countries dealing with us on trade know that the rules have changed. the united states h… https://t.co/momna1mui3",2017-11-14,15999,81037,trade,0.113,0.0,0.887,0.4215
great to see @randpaul looking well and back on the senate floor. he will help us with tax cuts and reform!,2017-11-14,10439,55820,tax,0.324,0.077,0.599,0.7901
"excited to be heading home to see the house pass a great tax bill with the middle class getting big tax cuts!

#makeamericagreatagain🇺🇸",2017-11-14,13757,74773,tax,0.243,0.079,0.679,0.68
"i am proud of the rep. house &amp; senate for working so hard on cutting taxes {&amp; reform.} we’re getting close! now, ho… https://t.co/bpmeywomhu",2017-11-13,15609,75036,tax,0.115,0.145,0.74,0.1931
"happy to announce, i am nominating alex azar to be the next hhs secretary. he will be a star for better healthcare and lower drug prices!",2017-11-13,12041,67840,price,0.229,0.073,0.698,0.69
"great day of bilateral meetings at #aseansummit on trade, which we are turning around to be great deals for our cou… https://t.co/n7g7zvo9pl",2017-11-13,8179,42418,trade,0.291,0.0,0.709,0.8481
"why would kim jong-un insult me by calling me ""old,"" when i would never call him ""short and fat?"" oh well, i try so… https://t.co/pmswnkh4r4",2017-11-12,260164,603820,kim,0.08,0.125,0.795,-0.296
president xi of china has stated that he is upping the sanctions against #noko. said he wants them to denuclearize. progress is being made.,2017-11-11,15235,74975,china,0.109,0.0,0.891,0.4215
president xi of china has stated that he is upping the sanctions against #noko. said he wants them to denuclearize. progress is being made.,2017-11-11,15235,74975,sanctions,0.109,0.0,0.891,0.4215
president xi of china has stated that he is upping the sanctions against #noko. said he wants them to denuclearize. progress is being made.,2017-11-11,15235,74975,nuclear,0.109,0.0,0.891,0.4215
"i am leaving china for #apec2017 in vietnam. @flotus melania is staying behind to see the zoo, and of course, the g… https://t.co/j2kdjwvnsj",2017-11-10,12743,69712,china,0.0,0.0,1.0,0.0
my meetings with president xi jinping were very productive on both trade and the subject of north korea. he is a hi… https://t.co/wqdulr1nyf,2017-11-09,14111,80131,trade,0.0,0.0,1.0,0.0
"i don’t blame china, i blame the incompetence of past admins for allowing china to take advantage of the u.s. on tr… https://t.co/zql9wfezlf",2017-11-09,27556,130728,china,0.074,0.299,0.627,-0.7269
in the coming months and years ahead i look forward to building an even stronger relationship between the united st… https://t.co/khceqsqdtk,2017-11-09,19369,91546,build,0.231,0.0,0.769,0.6597
leaving south korea now heading to china. looking very much forward to meeting and being with president xi!,2017-11-08,10725,70110,china,0.0,0.0,1.0,0.0
"the north korean regime has pursued its nuclear &amp; ballistic missile programs in defiance of every assurance, agreem… https://t.co/j7wklthu2q",2017-11-08,9810,41723,missile,0.118,0.0,0.882,0.34
"the north korean regime has pursued its nuclear &amp; ballistic missile programs in defiance of every assurance, agreem… https://t.co/j7wklthu2q",2017-11-08,9810,41723,nuclear,0.118,0.0,0.882,0.34
"the u.s., under my administration, is completely rebuilding its military, and they're spending hundreds of billions… https://t.co/2siwl0th9x",2017-11-08,13671,58076,build,0.0,0.0,1.0,0.0
"getting ready to make a major speech to the national assembly here in south korea, then will be headed to china whe… https://t.co/mefwxmpzrw",2017-11-08,10300,60344,china,0.106,0.0,0.894,0.3612
....and has been horrible on virginia economy. vote @edwgillespie today!,2017-11-07,6740,33605,economy,0.0,0.296,0.704,-0.5848
"....is making. working very hard on tax cuts for the middle class, companies and jobs!",2017-11-07,6691,41531,tax,0.0,0.244,0.756,-0.4914
"....is making. working very hard on tax cuts for the middle class, companies and jobs!",2017-11-07,6691,41531,jobs,0.0,0.244,0.756,-0.4914
"....is making. working very hard on tax cuts for the middle class, companies and jobs!",2017-11-07,6691,41531,jobs,0.0,0.244,0.756,-0.4914
stock market hit yet another all-time record high yesterday. there is great confidence in the moves that my administration....,2017-11-07,11092,60723,market,0.303,0.0,0.697,0.8126
stock market hit yet another all-time record high yesterday. there is great confidence in the moves that my administration....,2017-11-07,11092,60723,stock,0.303,0.0,0.697,0.8126
stock market hit yet another all-time record high yesterday. there is great confidence in the moves that my administration....,2017-11-07,11092,60723,market,0.303,0.0,0.697,0.8126
"the state of virginia economy, under democrat rule, has been terrible. if you vote ed gillespie tomorrow, it will come roaring back!",2017-11-06,19137,75918,economy,0.0,0.139,0.861,-0.5255
heading into the 12 days with great negotiating strength because of our tremendous economy. https://t.co/4hnxkr3ehw,2017-11-05,11616,56268,economy,0.36,0.0,0.64,0.8074
would very much appreciate saudi arabia doing their ipo of aramco with the new york stock exchange. important to the united states!,2017-11-04,17623,68399,stock,0.293,0.0,0.707,0.7827
"unemployment is down to 4.1%, lowest in 17 years. 1.5 million new jobs created since i took office. highest stock market ever, up $5.4 trill",2017-11-04,36726,155123,market,0.07,0.193,0.737,-0.5423
"unemployment is down to 4.1%, lowest in 17 years. 1.5 million new jobs created since i took office. highest stock market ever, up $5.4 trill",2017-11-04,36726,155123,stock,0.07,0.193,0.737,-0.5423
"unemployment is down to 4.1%, lowest in 17 years. 1.5 million new jobs created since i took office. highest stock market ever, up $5.4 trill",2017-11-04,36726,155123,market,0.07,0.193,0.737,-0.5423
"unemployment is down to 4.1%, lowest in 17 years. 1.5 million new jobs created since i took office. highest stock market ever, up $5.4 trill",2017-11-04,36726,155123,unemployment,0.07,0.193,0.737,-0.5423
"unemployment is down to 4.1%, lowest in 17 years. 1.5 million new jobs created since i took office. highest stock market ever, up $5.4 trill",2017-11-04,36726,155123,jobs,0.07,0.193,0.737,-0.5423
"unemployment is down to 4.1%, lowest in 17 years. 1.5 million new jobs created since i took office. highest stock market ever, up $5.4 trill",2017-11-04,36726,155123,jobs,0.07,0.193,0.737,-0.5423
"jobs, jobs, jobs! https://t.co/twunktgbnb",2017-11-03,15274,65209,jobs,0.0,0.0,1.0,0.0
"jobs, jobs, jobs! https://t.co/twunktgbnb",2017-11-03,15274,65209,jobs,0.0,0.0,1.0,0.0
"just took off for ceremony @ pearl harbor. will then be heading to japan, skorea, china, vietnam &amp; the philippines. will never let you down!",2017-11-03,13174,71861,china,0.0,0.0,1.0,0.0
"...based on that, the military has hit isis ""much harder"" over the last two days. they will pay a big price for every attack on us!",2017-11-03,14361,68132,price,0.0,0.172,0.828,-0.5848
"great tax cut rollout today. the lobbyists are storming capital hill, but the republicans will hold strong and do what is right for america!",2017-11-03,12522,62082,tax,0.244,0.052,0.704,0.7745
....for the middle class. the house and senate should consider asap as the process of final approval moves along. push biggest tax cuts ever,2017-11-01,11089,54095,tax,0.114,0.081,0.806,0.2263
wouldn't it be great to repeal the very unfair and unpopular individual mandate in obamacare and use those savings for further tax cuts.....,2017-11-01,16609,79816,tax,0.0,0.242,0.758,-0.7709
the republican house members are working hard (and late) toward the massive tax cuts that they know you deserve. these will be biggest ever!,2017-11-01,12956,67300,tax,0.0,0.15,0.85,-0.4389
“home prices reach new all-time highs in august” read more: https://t.co/xzjizggq8r https://t.co/stbtr6mo2j,2017-10-31,6155,28444,price,0.091,0.0,0.909,0.0258
rt @ivankatrump: we're working to make tax cuts &amp; the expanded child tax credit a reality for american families. the time is now! #taxrefor…,2017-10-31,9228,0,tax,0.111,0.084,0.805,0.1759
i hope people will start to focus on our massive tax cuts for business (jobs) and the middle class (in addition to democrat corruption)!,2017-10-31,16330,73890,tax,0.121,0.083,0.796,0.2481
i hope people will start to focus on our massive tax cuts for business (jobs) and the middle class (in addition to democrat corruption)!,2017-10-31,16330,73890,jobs,0.121,0.083,0.796,0.2481
i hope people will start to focus on our massive tax cuts for business (jobs) and the middle class (in addition to democrat corruption)!,2017-10-31,16330,73890,jobs,0.121,0.083,0.796,0.2481
"all of this ""russia"" talk right when the republicans are making their big push for historic tax cuts &amp; reform. is this coincidental? not!",2017-10-29,22708,90602,tax,0.0,0.098,0.902,-0.3595
"as usual, the obamacare premiums will be up (the dems own it), but we will repeal &amp; replace and have great healthcare soon after tax cuts!",2017-10-29,13739,66383,tax,0.181,0.086,0.733,0.63
"diane black of tennessee, the highly respected house budget committee chairwoman, did a great job in passing budget, setting up big tax cuts",2017-10-27,11456,60326,tax,0.261,0.077,0.662,0.7425
"congratulations to @speakerryan, @gopleader, @stevescalise and to the republican party on budget passage yesterday. now for biggest tax cuts",2017-10-27,8482,45115,tax,0.266,0.089,0.645,0.6597
"ed gillespie will turn the really bad virginia economy #'s around, and fast. strong on crime, he might even save our great statues/heritage!",2017-10-26,12829,60226,economy,0.301,0.202,0.497,0.5572
"this will be the biggest tax cut in the history of our country - and we need it! #taxreform 
read more:… https://t.co/1qdehblabt",2017-10-26,11396,49939,tax,0.0,0.107,0.893,-0.3382
rt @ivankatrump: working families need #taxreform &amp; the time is now. this administration is committed to ensuring all americans can thrive…,2017-10-26,8799,0,tax,0.181,0.0,0.819,0.4939
melania and i look forward to being with president xi &amp; madame peng liyuan in china in two weeks for what will hope… https://t.co/tynkl929s6,2017-10-25,8568,45082,china,0.0,0.0,1.0,0.0
"spoke to president xi of china to congratulate him on his extraordinary elevation. also discussed noko &amp; trade, two very important subjects!",2017-10-25,9394,54111,china,0.218,0.0,0.782,0.6793
"spoke to president xi of china to congratulate him on his extraordinary elevation. also discussed noko &amp; trade, two very important subjects!",2017-10-25,9394,54111,trade,0.218,0.0,0.782,0.6793
"working hard on the biggest tax cut in u.s. history. great support from so many sides. big winners will be the middle class, business &amp; jobs",2017-10-25,18009,92443,tax,0.288,0.102,0.61,0.8126
"working hard on the biggest tax cut in u.s. history. great support from so many sides. big winners will be the middle class, business &amp; jobs",2017-10-25,18009,92443,jobs,0.288,0.102,0.61,0.8126
"working hard on the biggest tax cut in u.s. history. great support from so many sides. big winners will be the middle class, business &amp; jobs",2017-10-25,18009,92443,jobs,0.288,0.102,0.61,0.8126
so nice being with republican senators today. multiple standing ovations! most are great people who want big tax cuts and success for u.s.,2017-10-24,16177,86159,tax,0.387,0.067,0.546,0.8901
stock market just hit another record high! jobs looking very good.,2017-10-24,18267,96306,market,0.258,0.0,0.742,0.54
stock market just hit another record high! jobs looking very good.,2017-10-24,18267,96306,stock,0.258,0.0,0.742,0.54
stock market just hit another record high! jobs looking very good.,2017-10-24,18267,96306,market,0.258,0.0,0.742,0.54
stock market just hit another record high! jobs looking very good.,2017-10-24,18267,96306,jobs,0.258,0.0,0.742,0.54
stock market just hit another record high! jobs looking very good.,2017-10-24,18267,96306,jobs,0.258,0.0,0.742,0.54
"isn't it sad that lightweight senator bob corker, who couldn't get re-elected in the great state of tennessee, will now fight tax cuts plus!",2017-10-24,13411,57523,tax,0.219,0.151,0.63,0.4847
"bob corker, who helped president o give us the bad iran deal &amp; couldn't get elected dog catcher in tennessee, is now fighting tax cuts....",2017-10-24,19599,80258,tax,0.0,0.214,0.786,-0.7184
"there will be no change to your 401(k). this has always been a great and popular middle class tax break that works, and it stays!",2017-10-23,23729,113610,tax,0.237,0.072,0.691,0.7177
"...2nd amendment, strong military, isis, historic va improvement, supreme court justice, record stock market, lowest unemployment in 17 yrs!",2017-10-22,16422,76146,market,0.424,0.171,0.405,0.8439
"...2nd amendment, strong military, isis, historic va improvement, supreme court justice, record stock market, lowest unemployment in 17 yrs!",2017-10-22,16422,76146,stock,0.424,0.171,0.405,0.8439
"...2nd amendment, strong military, isis, historic va improvement, supreme court justice, record stock market, lowest unemployment in 17 yrs!",2017-10-22,16422,76146,market,0.424,0.171,0.405,0.8439
"...2nd amendment, strong military, isis, historic va improvement, supreme court justice, record stock market, lowest unemployment in 17 yrs!",2017-10-22,16422,76146,unemployment,0.424,0.171,0.405,0.8439
"i agree getting tax cuts approved  is important (we will also get healthcare), but perhaps no administration has done more in its first.....",2017-10-21,13077,70375,tax,0.191,0.166,0.643,-0.09
"just out, but lightly reported: ""fewest jobless claims since 1973 show firm u.s. job market"" lowest since march 1973. @bpolitics",2017-10-21,16332,64947,market,0.0,0.152,0.848,-0.5267
"just out, but lightly reported: ""fewest jobless claims since 1973 show firm u.s. job market"" lowest since march 1973. @bpolitics",2017-10-21,16332,64947,market,0.0,0.152,0.848,-0.5267
stock market hits another all time high on friday. 5.3 trillion dollars up since election. fake news doesn't spent much time on this!,2017-10-21,20100,92306,market,0.0,0.134,0.866,-0.5255
stock market hits another all time high on friday. 5.3 trillion dollars up since election. fake news doesn't spent much time on this!,2017-10-21,20100,92306,stock,0.0,0.134,0.866,-0.5255
stock market hits another all time high on friday. 5.3 trillion dollars up since election. fake news doesn't spent much time on this!,2017-10-21,20100,92306,market,0.0,0.134,0.866,-0.5255
"budget that just passed is a really big deal, especially in terms of what will be the biggest tax cut in u.s. history - msm barely covered!",2017-10-21,14745,68287,tax,0.0,0.091,0.909,-0.3382
this is a once-in-a-generation opportunity to offer historic tax relief to the american people! join me today:… https://t.co/faxijyr08m,2017-10-20,15181,62362,tax,0.375,0.0,0.625,0.8122
"....this now allows for the passage of large scale tax cuts (and reform), which will be the biggest in the history of our country!",2017-10-20,14440,72705,tax,0.0,0.098,0.902,-0.3595
"the budget passed late last night, 51 to 49. we got zero democrat votes with only rand paul (he will vote for tax cuts) voting against.....",2017-10-20,15119,69330,tax,0.0,0.0,1.0,0.0
